<?xml version="1.0" encoding="UTF-8"?>
<changes xmlns="http://buildbox.sf.net/changes/2.0"
         xmlns:xsi="http://www.w3.org/2001/XMLSchema-instance"
         xsi:schemaLocation="http://buildbox.sf.net/changes/2.0 http://buildbox.sourceforge.net/releasator/changes.xsd">
  <release groupId="net.sf.buildbox.test" artifactId="mm-onechild" version="1.0.0-alpha-2" timestamp="2009-12-03T00:46:43.536Z" author="releasator@gmail.com" codename="container with one child">
    <item>test item description</item>
    <buildtool role="release" groupId="org.apache.maven.plugins" artifactId="maven-release-plugin" version="2.1"/>
    <buildtool role="release" groupId="net.sf.buildbox" artifactId="releasator" version="1-SNAPSHOT-2009-12-02T23:17:09.335Z"/>
    <os arch="i386" name="Linux" version="2.6.31-15-generic"/>
    <vcs type="svn" id="local.svn" revision="2" location="/trunk/mm-onechild" tag="net.sf.buildbox.test-mm-onechild-1.0.0-alpha-2"/>
    <module groupId="net.sf.buildbox.test" artifactId="mm-onechild" version="1.0.0-alpha-2">
      <artifact type="pom"/>
    </module>
    <module groupId="net.sf.buildbox.test" artifactId="mm-onechild-solo" version="1.0.0-alpha-2">
      <artifact type="jar"/>
      <artifact type="pom"/>
    </module>
  </release>
</changes>