<?xml version="1.0" encoding="UTF-8"?>
<changes xmlns="http://buildbox.sf.net/changes/2.0"
         xmlns:xsi="http://www.w3.org/2001/XMLSchema-instance"
         xsi:schemaLocation="http://buildbox.sf.net/changes/2.0 http://buildbox.sourceforge.net/releasator/changes.xsd">
    <configuration>
      <property name="maven-release-plugin.version">2.1</property>
    </configuration>
  <release groupId="net.sf.buildbox.test" artifactId="mm-twins" version="1.0.0-alpha-3" timestamp="2009-12-03T17:04:19.041Z" author="releasator@gmail.com" codename="container with two children">
    <item>test item description</item>
    <buildtool role="release" groupId="org.apache.maven.plugins" artifactId="maven-release-plugin" version="2.1"/>
    <buildtool role="release" groupId="net.sf.buildbox" artifactId="releasator" version="1-SNAPSHOT-2009-12-03T17:00:18.668Z"/>
    <os arch="i386" name="Linux" version="2.6.31-15-generic"/>
    <vcs type="svn" id="local.svn" revision="8" location="/trunk/mm-twins" tag="/tags/net.sf.buildbox.test-mm-twins-1.0.0-alpha-3"/>
    <module groupId="net.sf.buildbox.test" artifactId="mm-twins" version="1.0.0-alpha-3">
      <artifact type="pom"/>
    </module>
    <module groupId="net.sf.buildbox.test" artifactId="twins-prima" version="1.0.0-alpha-3">
      <artifact type="jar"/>
      <artifact type="pom"/>
    </module>
    <module groupId="net.sf.buildbox.test" artifactId="twins-seconda" version="1.0.0-alpha-3">
      <artifact type="jar"/>
      <artifact type="pom"/>
    </module>
  </release>
</changes>